{"$schema":"https://json-schema.org/draft/2020-12/schema","title":"DevFlower review-result v1 (design contract)","type":"object","additionalProperties":false,"required":["schema_version","run_id","round","candidate_sha256","acceptance_sha256","verdict","contracts","findings","limitations"],"properties":{"schema_version":{"const":1},"run_id":{"type":"string","minLength":1},"round":{"type":"integer","minimum":1},"candidate_sha256":{"type":"string","pattern":"^[0-9a-f]{64}$"},"acceptance_sha256":{"type":"string","pattern":"^[0-9a-f]{64}$"},"verdict":{"enum":["ACCEPT","ACCEPT_WITH_LIMITATIONS","NEEDS_CORRECTION","BLOCKED"]},"contracts":{"type":"array","minItems":1,"items":{"type":"object","additionalProperties":false,"required":["id","status","evidence_refs"],"properties":{"id":{"type":"string","minLength":1},"status":{"enum":["PASS","FAIL","BLOCKED","NOT_APPLICABLE"]},"evidence_refs":{"type":"array","items":{"type":"string","minLength":1}}}}},"findings":{"type":"array","items":{"type":"object","additionalProperties":false,"required":["id","severity","status","title","contract_ids","evidence_refs"],"properties":{"id":{"type":"string","minLength":1},"severity":{"enum":["P0","P1","P2","P3"]},"status":{"enum":["OPEN","CLOSED","BLOCKED","NOT_REPRODUCED"]},"title":{"type":"string","minLength":1},"contract_ids":{"type":"array","items":{"type":"string","minLength":1}},"evidence_refs":{"type":"array","items":{"type":"string","minLength":1}}}}},"limitations":{"type":"array","items":{"type":"string","minLength":1}}}}
