{"acceptance_sha256":"8f4b3ce335a2054b737e3fc2e4300096543accb7fb4347bd80c8f0cdcc053c7c","candidate_sha256":"0d1869aa19b15629fc0de6e68668fc8815a10505a77d214fd8a5662835f265a5","contracts":[{"evidence_refs":["chromium","product-ui","source-inspection"],"id":"I14-01","status":"PASS"},{"evidence_refs":["projection","chromium","source-inspection"],"id":"I14-02","status":"PASS"},{"evidence_refs":["native-session","product-ui","source-inspection"],"id":"I14-03","status":"PASS"},{"evidence_refs":["native-sequence","native-merge","product-ui","source-inspection"],"id":"I14-04","status":"PASS"},{"evidence_refs":["chromium","source-inspection"],"id":"I14-05","status":"PASS"},{"evidence_refs":["host","source-inspection"],"id":"I14-06","status":"PASS"},{"evidence_refs":["python","host","editor","projection","chromium","baseline","syntax"],"id":"I14-07","status":"PASS"},{"evidence_refs":["source-inspection"],"id":"I14-08","status":"PASS"},{"evidence_refs":["python","model-discovery","source-inspection"],"id":"I16-A","status":"FAIL"},{"evidence_refs":["chromium","close-navigation","source-inspection"],"id":"I16-B","status":"PASS"},{"evidence_refs":["native-sequence","native-merge","product-ui","source-inspection"],"id":"I16-C","status":"PASS"},{"evidence_refs":["native-routing","classifier-benchmark","source-inspection"],"id":"I16-D","status":"PASS"},{"evidence_refs":["classifier-benchmark","source-inspection"],"id":"I16-JEV","status":"PASS"},{"evidence_refs":["sim-reference","product-ui","chromium","rebuild","source-inspection"],"id":"I16-F","status":"PASS"},{"evidence_refs":["native-session","model-discovery","source-inspection"],"id":"I16-E1","status":"PASS"},{"evidence_refs":["close-navigation","chromium","source-inspection"],"id":"I16-E2","status":"PASS"},{"evidence_refs":["native-sequence","native-merge","product-ui","source-inspection"],"id":"I16-E3","status":"PASS"},{"evidence_refs":["native-routing","classifier-benchmark","source-inspection"],"id":"I16-E4","status":"PASS"},{"evidence_refs":["native-sequence","native-merge","native-routing","source-inspection"],"id":"I16-E5","status":"PASS"},{"evidence_refs":["native-sequence","native-merge","source-inspection"],"id":"I16-E6","status":"PASS"},{"evidence_refs":["python","host","editor","projection","chromium","baseline","syntax"],"id":"I16-E7","status":"PASS"},{"evidence_refs":["source-inspection"],"id":"I16-E8","status":"PASS"},{"evidence_refs":["source-inspection"],"id":"I16-E9","status":"PASS"}],"findings":[{"contract_ids":["I16-A"],"evidence_refs":["python","model-discovery","source-inspection"],"id":"I16-A-MODEL-ADMISSION","severity":"P1","status":"OPEN","title":"P1 `python3 -B /home/workspace/DevFlower/archives/devflower-pr15-pr17-final-20261024/reviews/r5-pr17-recovery2/scratch/model_admission_counterexample.py` shows `tools/studio/model_catalog.py:140-151` and `tools/studio/workbench_runtime.py:89-92` admit an explicitly configured default even after a fresh successful native catalog omits it"},{"contract_ids":["I14-03"],"evidence_refs":["python","source-inspection"],"id":"I14-03-TOOL-TIMING","severity":"P1","status":"CLOSED","title":"CLOSED historical I14-03-TOOL-TIMING: `tools/studio/tool_activity.py:58-92` preserves validated native call IDs, timestamps, conflict handling, and duration only for ordered timestamps; the current focused Issue16 suite passes."},{"contract_ids":["I14-04"],"evidence_refs":["source-inspection"],"id":"I14-04-HANDOFF-ATTEMPT","severity":"P3","status":"CLOSED","title":"CLOSED historical I14-04-HANDOFF-ATTEMPT: `tools/studio/workbench_scheduler.py:138-142,214-218` uses deterministic activation identities and has no transfer replay transition; persisted handoff construction has the sole attempt value."},{"contract_ids":["I14-03"],"evidence_refs":["python","source-inspection"],"id":"I14-03-TOOL-UNKNOWN-PROTOCOL","severity":"P1","status":"CLOSED","title":"CLOSED historical I14-03-TOOL-UNKNOWN-PROTOCOL: `tools/studio/tool_activity.py:9-47` recursively fail-closes unknown, malformed, and decode-budget-exhausted protocol blocks before projection."},{"contract_ids":["I16-F"],"evidence_refs":["sim-reference","product-ui","chromium","rebuild","source-inspection"],"id":"I16-F-01","severity":"P1","status":"CLOSED","title":"CLOSED historical I16-F-01: current source contains the licensed Sim-derived hooks and attribution at `tools/studio/workbench_ui/vendor/sim/PROVENANCE.md`, while current-candidate UI interaction and theme evidence is bound by product proof and rebuild evidence."},{"contract_ids":["I16-E5","I16-E6"],"evidence_refs":["python","source-inspection"],"id":"I16-WORKER-01","severity":"P1","status":"CLOSED","title":"CLOSED historical I16-WORKER-01: `tools/studio/workbench_worker.py:18-25` catches `BaseException` and delegates to `tools/studio/workbench_failures.py:10-42`, which persists recovery-required state and only stops verified owned processes."},{"contract_ids":["I16-E5","I16-E6"],"evidence_refs":["native-sequence","native-merge","native-routing","source-inspection"],"id":"I16-E5E6-01","severity":"P1","status":"CLOSED","title":"CLOSED historical I16-E5E6-01: `native/sequence`, `native/merge`, both route cases, and both loop cases are current-candidate real native executions with successful final proof; `tools/studio/workbench_runtime.py:260-280` refuses replay absent an identity-bound completion receipt."},{"contract_ids":["I16-JEV"],"evidence_refs":["classifier-benchmark","source-inspection"],"id":"I16-JEV-01","severity":"P2","status":"CLOSED","title":"CLOSED historical I16-JEV-01: `evidence/pr17-final-audit/jev-identity.json` identifies the TypeSafe System One API and SDK boundary; `classifier-benchmark/results.json` accurately reports Jev n=0 and no integration without separately configured credentials."},{"contract_ids":["I14-06","I16-E7"],"evidence_refs":["source-inspection"],"id":"I16-HYG-01","severity":"P3","status":"CLOSED","title":"CLOSED historical I16-HYG-01: manifest verification found 173 listed files, 173 actual files, and no `__pycache__` or `.pyc` artifact in `/home/workspace/DevFlower/archives/devflower-pr15-pr17-final-20261024/reviews/r5-pr17-recovery2/candidate`."},{"contract_ids":["I16-B"],"evidence_refs":["chromium","source-inspection"],"id":"I16-A11Y-01","severity":"P3","status":"CLOSED","title":"CLOSED historical I16-A11Y-01: `tools/studio/workbench_ui/index.jsx:243` renders each session-tab opener and close control as sibling buttons rather than nested interactive controls."}],"limitations":["The P1 model-admission counterexample is a bounded local runtime fixture, not a claim that the audited account's currently discovered default model is unavailable. It establishes that a fresh authoritative catalog omission is not an admission gate; remediation must bind creation to fresh capability/authentication evidence or explicitly obtain equivalent native verification.","The supplied current-candidate full regression evidence reports 517 Python tests and all listed host/editor/projection/Chromium/syntax checks with zero reported failures, errors, and skips. This recovery review independently reran focused Issue16 (34/34) and editor/projection (20/20) checks; it does not reinterpret the prior infrastructure timeout as a test result.","User personal UX acceptance remains pending; agent-operated Chromium/product evidence is not personal acceptance.","The fixed Stable Gate and any PR15→PR17 merge occur after this report and were not executed here. Stable promotion remains outside scope.","Actual physical model backend and effective effort remain unknown where provider receipts do not independently expose them. Jev has no configured independent credential and no Jev call was made; the delivered comparison reports that limitation rather than fabricating measurements."],"round":5,"run_id":"7120c8604d44468eb353931ac0cbb384","schema_version":1,"verdict":"NEEDS_CORRECTION"}
