{"acceptance_sha256":"a1c7c38c52863db3f6b0832f1143851ad156c4c1aeefb3c8ff17be91d5a04bdb","candidate_sha256":"302125c7e87ff5f7bb4e6bcc57ac38ae0ecb375ac445d22410a5adc7ab9f28c9","contracts":[{"evidence_refs":["source-inspection","chromium","editor"],"id":"I14-01","status":"PASS"},{"evidence_refs":["source-inspection","projection","chromium","native-sequence","native-merge"],"id":"I14-02","status":"PASS"},{"evidence_refs":["source-inspection","python","chromium","native-session"],"id":"I14-03","status":"PASS"},{"evidence_refs":["source-inspection","chromium","native-sequence","native-merge"],"id":"I14-04","status":"PASS"},{"evidence_refs":["source-inspection","chromium","python"],"id":"I14-05","status":"PASS"},{"evidence_refs":["source-inspection","python","host","baseline"],"id":"I14-06","status":"PASS"},{"evidence_refs":["python","host","editor","projection","chromium","baseline","syntax","rebuild","native-sequence","native-merge","native-session"],"id":"I14-07","status":"PASS"},{"evidence_refs":["source-inspection","rebuild","native-sequence","native-merge","product-ui","native-session"],"id":"I14-08","status":"PASS"}],"findings":[{"contract_ids":["I14-03"],"evidence_refs":["source-inspection","python"],"id":"I14-03-TOOL-TIMING","severity":"P1","status":"CLOSED","title":"CLOSED historical I14-03-TOOL-TIMING: `tools/studio/tool_activity.py:58-92` retains validated native IDs, pairs reverse concurrent results only by ID, and computes timing only from valid ordered timestamps; `python3 -B /home/workspace/DevFlower/archives/devflower-pr15-pr17-final-20261024/reviews/r4-pr15-final/scratch/adversarial_tool_projection.py` passed with alpha=12 and beta=1 rather than using arrival order."},{"contract_ids":["I14-04"],"evidence_refs":["source-inspection","python"],"id":"I14-04-HANDOFF-ATTEMPT","severity":"P3","status":"CLOSED","title":"CLOSED historical I14-04-HANDOFF-ATTEMPT: source inspection of `tools/studio/workbench_scheduler.py:136-142,203-206` establishes a deterministic activation identity and the only persisted handoff construction has `attempt=1`; no transfer-retry transition exists, so the old multiple-attempt collapse case in `tools/studio/workbench_ui/trace_views.jsx:35-49` is unreachable in this candidate."},{"contract_ids":["I14-03","I14-06"],"evidence_refs":["source-inspection","python"],"id":"I14-03-TOOL-UNKNOWN-PROTOCOL","severity":"P1","status":"CLOSED","title":"CLOSED historical I14-03-TOOL-UNKNOWN-PROTOCOL: `tools/studio/tool_activity.py:9-47` recursively fail-closes unknown, malformed, and decode-budget-exhausted protocol blocks before the UI receives activity; the exact command `python3 -B /home/workspace/DevFlower/archives/devflower-pr15-pr17-final-20261024/reviews/r4-pr15-final/scratch/adversarial_tool_projection.py` passed without exposing its private sentinel, and focused candidate tests passed 17/17."}],"limitations":["This is a technical PR15 candidate review, not the user's personal UX acceptance; it does not execute the later fixed Stable Gate, merge PR15 or PR17, promote Stable, or substitute for the required post-integration PR17 validation/review.","The reviewer container lacks the `esbuild` dependency, so a second local bundle build was not possible. The two declared generated bundles were not read; their candidate bytes matched the 154-file manifest exactly, and supplied `rebuild.json` records byte-identical rebuild success for this candidate."],"round":4,"run_id":"7120c8604d44468eb353931ac0cbb384","schema_version":1,"verdict":"ACCEPT"}
