{"acceptance_sha256":"90d1c835df611f68ccc92a84406c125b708c3b91fd25f81387810596269f89b6","candidate_sha256":"7b0c0b3bcc95235e02eadb74b71dd5f50d3d9c88da178b4787ff2090d1978210","contracts":[{"evidence_refs":["counterexample","python","native-admission"],"id":"I16-A","status":"PASS"},{"evidence_refs":["rebuild","source-privacy"],"id":"MA-01","status":"PASS"},{"evidence_refs":["python","model-discovery"],"id":"MA-02","status":"PASS"},{"evidence_refs":["python","native-admission","native-negative"],"id":"MA-03","status":"PASS"},{"evidence_refs":["counterexample","python","model-discovery"],"id":"MA-04","status":"PASS"},{"evidence_refs":["counterexample","python"],"id":"MA-05","status":"PASS"},{"evidence_refs":["python","model-discovery","native-admission"],"id":"MA-06","status":"PASS"},{"evidence_refs":["counterexample","python","native-negative"],"id":"MA-07","status":"PASS"},{"evidence_refs":["rebuild","source-privacy"],"id":"MA-08","status":"PASS"},{"evidence_refs":["python","host","editor","projection","chromium","baseline","syntax","rebuild","native-admission","native-sequence","native-merge","native-negative","native-session"],"id":"MA-09","status":"BLOCKED"},{"evidence_refs":["rebuild","native-sequence"],"id":"MA-10","status":"BLOCKED"}],"findings":[{"contract_ids":["I16-A","MA-05","MA-07"],"evidence_refs":["counterexample","python"],"id":"MA-05-VERIFICATION-REVOCATION-RACE","severity":"P1","status":"CLOSED","title":"CLOSED prior P1 MA-05-VERIFICATION-REVOCATION-RACE: `python3 -B /home/workspace/DevFlower/archives/devflower-model-admission-20261024/reviews/source-r2/scratch/revocation_race_counterexample.py` now returns `RESULT=REJECTED late_receipt=True`, `execution_allowed=False`, and `stored_state=FAILED`; `tools/studio/model_admission.py:70-81,191-205` CAS-publishes verification only over its own STARTING record."},{"contract_ids":["I16-A","MA-04"],"evidence_refs":["counterexample","python","model-discovery"],"id":"I16-A-MODEL-ADMISSION","severity":"P1","status":"CLOSED","title":"CLOSED historical I16-A-MODEL-ADMISSION: `tools/studio/model_catalog.py:140-166` separates registered from discovered and executable; the immutable recorded omitted-default counterexample remains rejected, and the same-candidate admission suite passes 30/30."},{"contract_ids":["MA-09"],"evidence_refs":["python","host"],"id":"I14-03-TOOL-TIMING","severity":"P1","status":"CLOSED","title":"CLOSED historical I14-03-TOOL-TIMING: `tools/studio/tool_activity.py:58-92` continues to retain validated call IDs and ordered timestamps, derive duration only from valid ordering, and fail closed on association conflict; recorded same-candidate Python and host regressions pass."},{"contract_ids":["MA-09"],"evidence_refs":["python","native-sequence"],"id":"I14-04-HANDOFF-ATTEMPT","severity":"P3","status":"CLOSED","title":"CLOSED historical I14-04-HANDOFF-ATTEMPT: `tools/studio/workbench_scheduler.py:76-81,139-145` records deterministic activation identity and attempt before handoff emission; the round-two failed sequence preserves the handoff observation rather than replaying it."},{"contract_ids":["MA-09"],"evidence_refs":["python","source-privacy"],"id":"I14-03-TOOL-UNKNOWN-PROTOCOL","severity":"P1","status":"CLOSED","title":"CLOSED historical I14-03-TOOL-UNKNOWN-PROTOCOL: `tools/studio/tool_activity.py:9-47` recursively omits malformed, unknown, and exhausted-decode protocol values before projection."},{"contract_ids":["MA-08","MA-09"],"evidence_refs":["rebuild","chromium"],"id":"I16-F-01","severity":"P1","status":"CLOSED","title":"CLOSED historical I16-F-01: `tools/studio/workbench_ui/vendor/sim/PROVENANCE.md:1-9` preserves source, licence, modification, and non-authority boundaries; the same-candidate UI build is byte-identical and recorded Chromium regression reports 60 tests with 0 failures and 0 skips."},{"contract_ids":["MA-09"],"evidence_refs":["python","host"],"id":"I16-WORKER-01","severity":"P1","status":"CLOSED","title":"CLOSED historical I16-WORKER-01: `tools/studio/workbench_worker.py:18-25` delegates unexpected failures to `tools/studio/workbench_failures.py:10-42`, which persists recovery-required state and only stops verified same-host/boot-owned groups."},{"contract_ids":["MA-09"],"evidence_refs":["python","native-sequence"],"id":"I16-E5E6-01","severity":"P1","status":"CLOSED","title":"CLOSED historical I16-E5E6-01 source behavior: `tools/studio/workbench_runtime.py:268-288` refuses unsafe recovery without identity-bound completion evidence; the current failed native sequence was terminally recorded as FAILED/SKIPPED and was not replayed."},{"contract_ids":["MA-01"],"evidence_refs":["python","baseline"],"id":"I16-JEV-01","severity":"P2","status":"CLOSED","title":"CLOSED historical I16-JEV-01: `docs/WORKBENCH.md:75-84` identifies Jev as TypeSafe System One, reports unconfigured independent credentials and n=0 calls, and leaves unmeasured claims unknown."},{"contract_ids":["MA-01","MA-08"],"evidence_refs":["rebuild","source-privacy"],"id":"I16-HYG-01","severity":"P3","status":"CLOSED","title":"CLOSED historical I16-HYG-01: `python3 -I -B` recomputation against `/home/workspace/DevFlower/archives/devflower-model-admission-20261024/reviews/source-r2/candidate-manifest.json` finds 175 complete matching entries and candidate SHA-256 `7b0c0b3bcc95235e02eadb74b71dd5f50d3d9c88da178b4787ff2090d1978210`."},{"contract_ids":["MA-09"],"evidence_refs":["chromium","editor"],"id":"I16-A11Y-01","severity":"P3","status":"CLOSED","title":"CLOSED historical I16-A11Y-01: `tools/studio/workbench_ui/index.jsx:243` keeps each session-tab opener and close action as sibling buttons; recorded same-candidate Chromium evidence reports 60 tests, 0 failures, 0 skips."}],"limitations":["Round two is a new candidate with exactly two manifest deltas from immutable `/home/workspace/DevFlower/archives/devflower-model-admission-20261024/reviews/source-r1-recovery2/candidate`: `tools/studio/model_admission.py` and `tests/test_model_admission.py`. The round-two complete tree recomputes to the required candidate SHA-256, and all 63 round-two evidence-manifest bytes hash-match.","The exact focused command `cd /home/workspace/DevFlower/archives/devflower-model-admission-20261024/reviews/source-r2/candidate && PYTHONDONTWRITEBYTECODE=1 PYTHONPATH=\"$PWD/tools:$PWD/tests\" python3 -B -m unittest test_model_admission -v` passed 30/30. The corresponding `test_issue16 test_workbench_runtime.HttpTests` command passed 37/37.","Recorded same-candidate broad evidence reports 547 Python tests, 6 host tests, 8 editor tests, 12 projection tests, all listed syntax checks, and Chromium workbench 60/60 with no failures. The generated bundle bytes were not read; their manifest hashes match and `/home/workspace/DevFlower/archives/devflower-model-admission-20261024/evidence/audit-r2-blocked/rebuild.json` says byte-identical.","MA-09 is blocked, not failed: `/home/workspace/DevFlower/archives/devflower-model-admission-20261024/evidence/audit-r2-blocked/runtime-disposition.json` records that the real Claude workflow call exceeded 300 seconds, the owned CLI exited -15, positive sequence did not pass, and merge was not run after the recovery budget was exhausted. `sequence-failed/error.json` records the resulting expected-COMPLETED versus actual-FAILED assertion. No native sequence/merge success is invented or reused from the old candidate.","MA-10 is blocked because the fixed external Stable Gate is expressly post-report and has not run; no merge, Stable promotion, or personal UX acceptance is claimed. Actual physical backend and effective effort remain unknown where providers do not independently prove them."],"round":2,"run_id":"77f822033450473d8b1040ab620ef4f3","schema_version":1,"verdict":"BLOCKED"}
