{"acceptance_sha256":"a1c7c38c52863db3f6b0832f1143851ad156c4c1aeefb3c8ff17be91d5a04bdb","candidate_sha256":"67554e7d833e9fe0de3e47e8f0420eb3aeed5d2e6cfd31c31e78e659e915fe49","contracts":[{"evidence_refs":["source-inspection","chromium"],"id":"I14-01","status":"PASS"},{"evidence_refs":["source-inspection","projection","chromium"],"id":"I14-02","status":"PASS"},{"evidence_refs":["source-inspection","python","chromium","native-session"],"id":"I14-03","status":"PASS"},{"evidence_refs":["source-inspection","chromium","native-merge"],"id":"I14-04","status":"PASS"},{"evidence_refs":["source-inspection","chromium"],"id":"I14-05","status":"PASS"},{"evidence_refs":["source-inspection","python","host"],"id":"I14-06","status":"PASS"},{"evidence_refs":["python","chromium","rebuild","native-sequence","native-merge","native-session"],"id":"I14-07","status":"PASS"},{"evidence_refs":["source-inspection"],"id":"I14-08","status":"PASS"}],"findings":[{"contract_ids":["I14-03"],"evidence_refs":["source-inspection","python","native-session"],"id":"I14-03-TOOL-TIMING","severity":"P1","status":"CLOSED","title":"CLOSED historical I14-03-TOOL-TIMING: `tools/studio/tool_activity.py:54-88` continues explicit native-ID pairing and timing; `/home/workspace/DevFlower/archives/devflower-pr15-pr17-final-20261024/reviews/r2-pr15-corrected/candidate/tests/test_workbench_tool_activity.py` passes 14/14 when invoked as `cd /home/workspace/DevFlower/archives/devflower-pr15-pr17-final-20261024/reviews/r2-pr15-corrected/candidate && python3 -B tests/test_workbench_tool_activity.py -v`."},{"contract_ids":["I14-04"],"evidence_refs":["source-inspection","native-merge"],"id":"I14-04-HANDOFF-ATTEMPT","severity":"P3","status":"CLOSED","title":"CLOSED historical I14-04-HANDOFF-ATTEMPT: complete-manifest delta confirms the previously inspected scheduler is unchanged, and its only handoff event construction remains the fixed `attempt=1` path; no transfer-retry path makes the historical multi-attempt presentation counterexample reachable."},{"contract_ids":["I14-03","I14-06"],"evidence_refs":["source-inspection","python"],"id":"I14-03-TOOL-UNKNOWN-PROTOCOL","severity":"P1","status":"CLOSED","title":"CLOSED prior P1 I14-03-TOOL-UNKNOWN-PROTOCOL: `tools/studio/tool_activity.py:9-43` now rejects unknown typed blocks recursively. `/home/workspace/DevFlower/archives/devflower-pr15-pr17-final-20261024/reviews/r2-pr15-corrected/scratch/counterexample_tool_protocols.py` and `counterexample_history_protocols.py` both show `leak=False` / `history_secret_leaked=False`; the candidate regression adds matching native-history coverage."}],"limitations":["Personal user UX acceptance remains pending and is not inferred from agent-operated Chromium checks.","The unchanged fixed Stable Gate is explicitly subsequent to this source review and was neither run nor claimed. Stable promotion remains separate.","No PR15 merge, PR17 integration, post-integration final validation/review, main remote readback, or fast-forward-only verification was performed in this review.","`/home/workspace/DevFlower/archives/devflower-pr15-pr17-final-20261024/evidence/pr15-corrected/rebuild.json` reports a byte-identical rebuild; I independently verified all 154 manifest rows and the exact hashes of the two excluded generated bundles, but did not invoke the unavailable local esbuild dependency tree.","An independent full-suite invocation `python3 -B -m unittest discover -s tests -v` returned exit 1 with harness-truncated output before a final diagnostic; the immutable same-candidate controlled-host evidence records 475 tests, zero failures/errors/skips, and exit 0, while the focused corrected test command independently passed 14/14."],"round":2,"run_id":"7120c8604d44468eb353931ac0cbb384","schema_version":1,"verdict":"ACCEPT_WITH_LIMITATIONS"}
