{"acceptance_sha256":"a1c7c38c52863db3f6b0832f1143851ad156c4c1aeefb3c8ff17be91d5a04bdb","candidate_sha256":"67554e7d833e9fe0de3e47e8f0420eb3aeed5d2e6cfd31c31e78e659e915fe49","contracts":[{"evidence_refs":["source-inspection","chromium"],"id":"I14-01","status":"PASS"},{"evidence_refs":["source-inspection","projection","chromium"],"id":"I14-02","status":"PASS"},{"evidence_refs":["source-inspection","python","chromium","native-session"],"id":"I14-03","status":"FAIL"},{"evidence_refs":["source-inspection","chromium","native-merge"],"id":"I14-04","status":"PASS"},{"evidence_refs":["source-inspection","chromium"],"id":"I14-05","status":"PASS"},{"evidence_refs":["source-inspection","python"],"id":"I14-06","status":"FAIL"},{"evidence_refs":["python","host","editor","projection","chromium","baseline","syntax","rebuild","native-sequence","native-merge","native-session"],"id":"I14-07","status":"PASS"},{"evidence_refs":["source-inspection"],"id":"I14-08","status":"PASS"}],"findings":[{"contract_ids":["I14-03"],"evidence_refs":["source-inspection","python","native-session"],"id":"I14-03-TOOL-TIMING","severity":"P1","status":"CLOSED","title":"CLOSED historical I14-03-TOOL-TIMING: native-ID pairing and duration remain present in `tools/studio/tool_activity.py:54-88`; `cd /home/workspace/DevFlower/archives/devflower-pr15-pr17-final-20261024/reviews/r3-pr15-evidence/candidate && python3 -B tests/test_workbench_tool_activity.py -v` passes 14/14."},{"contract_ids":["I14-04"],"evidence_refs":["source-inspection","native-merge"],"id":"I14-04-HANDOFF-ATTEMPT","severity":"P3","status":"CLOSED","title":"CLOSED historical I14-04-HANDOFF-ATTEMPT: `tools/studio/workbench_scheduler.py:205-206` persists `attempt=1` and this unchanged scheduler has no transfer-retry path, so the historical multi-attempt collapse case remains unreachable."},{"contract_ids":["I14-03","I14-06"],"evidence_refs":["source-inspection","python"],"id":"I14-03-TOOL-UNKNOWN-PROTOCOL","severity":"P1","status":"OPEN","title":"OPEN P1: `tools/studio/tool_activity.py:10-43` leaks unknown tool payloads when `type` is non-string or JSON is encoded beyond two decode passes. `python3 -B /home/workspace/DevFlower/archives/devflower-pr15-pr17-final-20261024/reviews/r3-pr15-evidence/scratch/counterexample_history_malformed_type.py` reproduces a secret in `WorkbenchSessions.history(...)[\"activity\"]`; `python3 -B /home/workspace/DevFlower/archives/devflower-pr15-pr17-final-20261024/reviews/r3-pr15-evidence/scratch/counterexample_protocol_matrix.py` reproduces triple-encoded leakage. This violates fail-closed hidden-protocol display requirements."}],"limitations":["Candidate manifest/tree is byte-identical to round 2; all 154 candidate rows and 154 evidence source-manifest rows match, and the two excluded bundles match candidate hashes. `/home/workspace/DevFlower/archives/devflower-pr15-pr17-final-20261024/evidence/pr15-final/rebuild.json` records byte-identical rebuild; local `esbuild` dependencies were not available to rerun the build.","The full suite command `TMPDIR=/tmp python3 -B -m unittest discover -s tests -v` was independently run from `/home/workspace/DevFlower/archives/devflower-pr15-pr17-final-20261024/reviews/r3-pr15-evidence/candidate`; it exited 1 because three isolation tests could not start nested bubblewrap (`bwrap: No permissions to create new namespace`). The same-candidate host regression record `/home/workspace/DevFlower/archives/devflower-pr15-pr17-final-20261024/evidence/pr15-final/regression/python.log` reports 475 tests, zero failures/errors/skips, exit 0; these outcomes are reported separately, not conflated.","`native-session-proof.json` references five native JSONL paths under `/home/workspace/DevFlower/archives/devflower-pr15-pr17-final-20261024/stage-pr15-corrected/native-homes`, which are absent now, so their referenced hashes cannot be independently re-read. The accompanying actual-run visible-history, event, and UI artifacts remain in `/home/workspace/DevFlower/archives/devflower-pr15-pr17-final-20261024/evidence/pr15-final/native/`.","Personal UX acceptance remains pending; agent-operated Chromium evidence is not personal acceptance. The fixed old Stable Gate was not run before this report; no PR merge, PR17 integration, post-integration review, or Stable promotion was performed. The open P1 must be corrected before conditional merges."],"round":3,"run_id":"7120c8604d44468eb353931ac0cbb384","schema_version":1,"verdict":"NEEDS_CORRECTION"}
