{"acceptance_sha256":"a1c7c38c52863db3f6b0832f1143851ad156c4c1aeefb3c8ff17be91d5a04bdb","candidate_sha256":"164a0cd29d338e0bc9257a8bc7f3eb292befcc7305f10792831c921eb8b032b9","contracts":[{"evidence_refs":["source-inspection","chromium"],"id":"I14-01","status":"PASS"},{"evidence_refs":["source-inspection","chromium"],"id":"I14-02","status":"PASS"},{"evidence_refs":["source-inspection","python"],"id":"I14-03","status":"FAIL"},{"evidence_refs":["source-inspection","native-merge"],"id":"I14-04","status":"PASS"},{"evidence_refs":["source-inspection","chromium"],"id":"I14-05","status":"PASS"},{"evidence_refs":["source-inspection","python"],"id":"I14-06","status":"FAIL"},{"evidence_refs":["python","chromium","rebuild","native-session","native-sequence","native-merge"],"id":"I14-07","status":"PASS"},{"evidence_refs":["source-inspection"],"id":"I14-08","status":"PASS"}],"findings":[{"contract_ids":["I14-03"],"evidence_refs":["source-inspection","python","native-sequence"],"id":"I14-03-TOOL-TIMING","severity":"P1","status":"CLOSED","title":"CLOSED historical I14-03-TOOL-TIMING: `tools/studio/tool_activity.py:32-66` and `tools/studio/workbench_sessions.py:284-314` retain explicit native IDs, pair reverse results by ID, and compute known durations; focused `PYTHONPATH=/home/workspace/DevFlower/archives/devflower-pr15-pr17-final-20261024/reviews/r1-pr15-recovery1/candidate/tools python3 -B -m unittest /home/workspace/DevFlower/archives/devflower-pr15-pr17-final-20261024/reviews/r1-pr15-recovery1/candidate/tests/test_workbench_tool_activity.py -v` passed 12/12."},{"contract_ids":["I14-04"],"evidence_refs":["source-inspection","native-merge"],"id":"I14-04-HANDOFF-ATTEMPT","severity":"P3","status":"CLOSED","title":"CLOSED historical I14-04-HANDOFF-ATTEMPT for this candidate: `tools/studio/workbench_scheduler.py:205-206` creates every persisted handoff with `attempt=1` and the scheduler has no transfer-retry path, so the historical multi-attempt collapse counterexample is unreachable under the current no-replay execution semantics."},{"contract_ids":["I14-03","I14-06"],"evidence_refs":["source-inspection","python"],"id":"I14-03-TOOL-UNKNOWN-PROTOCOL","severity":"P1","status":"OPEN","title":"P1 `tools/studio/tool_activity.py:15-21` leaks an unknown nested tool-protocol payload: `python3 -B /home/workspace/DevFlower/archives/devflower-pr15-pr17-final-20261024/reviews/r1-pr15-recovery1/scratch/counterexample_history_unknown_protocol.py` reproduces `INDEPENDENT-HIDDEN-PROTOCOL-SECRET` in `WorkbenchSessions.history(...)[\"activity\"]`, which the UI renders as a matched tool result and raw event."}],"limitations":["Personal UX acceptance remains pending; the agent-operated Chromium checks are not personal UX acceptance.","The fixed old Stable Gate executes after this report and was neither run nor claimed; Stable promotion remains separate.","`/home/workspace/DevFlower/archives/devflower-pr15-pr17-final-20261024/evidence/pr15/rebuild.json` reports exit 0 and byte-identical output, and the two excluded generated bundle hashes were independently matched to the candidate. I did not independently invoke `tools/studio/workbench_ui/build.mjs` because the candidate contains no bundled node_modules/esbuild dependency tree.","No PR merge, PR17 integration, fresh final validation, or main remote readback was performed; correction of the open P1 is required before those later technical gates."],"round":1,"run_id":"7120c8604d44468eb353931ac0cbb384","schema_version":1,"verdict":"NEEDS_CORRECTION"}
