{"schema_version":1,"run_id":"EXAMPLE-NOT-AN-EXECUTED-RUN","round":1,"candidate_sha256":"0000000000000000000000000000000000000000000000000000000000000000","acceptance_sha256":"1111111111111111111111111111111111111111111111111111111111111111","verdict":"BLOCKED","contracts":[{"id":"example.unit","status":"BLOCKED","evidence_refs":[]}],"findings":[],"limitations":["Schema illustration only; no real agent or verification has run."]}
