{"acceptance_sha256":"90d1c835df611f68ccc92a84406c125b708c3b91fd25f81387810596269f89b6","candidate_sha256":"bbdfb20b8ee80b4eaab1b00f7597a3289cc23d467853e45622b2c770bad20308","contracts":[{"evidence_refs":["counterexample","python","native-negative"],"id":"I16-A","status":"FAIL"},{"evidence_refs":["rebuild","source-privacy"],"id":"MA-01","status":"PASS"},{"evidence_refs":["python","model-discovery"],"id":"MA-02","status":"PASS"},{"evidence_refs":["python","native-admission","native-negative"],"id":"MA-03","status":"PASS"},{"evidence_refs":["counterexample","python","model-discovery"],"id":"MA-04","status":"PASS"},{"evidence_refs":["counterexample","python"],"id":"MA-05","status":"FAIL"},{"evidence_refs":["python","model-discovery","native-admission"],"id":"MA-06","status":"PASS"},{"evidence_refs":["counterexample","python","native-negative"],"id":"MA-07","status":"FAIL"},{"evidence_refs":["rebuild","source-privacy"],"id":"MA-08","status":"PASS"},{"evidence_refs":["python","host","editor","projection","chromium","baseline","syntax","rebuild","native-admission","native-sequence","native-merge","native-negative","native-session"],"id":"MA-09","status":"PASS"},{"evidence_refs":["rebuild","counterexample"],"id":"MA-10","status":"BLOCKED"}],"findings":[{"contract_ids":["I16-A","MA-05","MA-07"],"evidence_refs":["counterexample","python"],"id":"MA-05-VERIFICATION-REVOCATION-RACE","severity":"P1","status":"OPEN","title":"P1 `python3 -B /home/workspace/DevFlower/archives/devflower-model-admission-20261024/reviews/source-r1-recovery2/scratch/verification_revocation_race.py` shows `tools/studio/model_admission.py:159-197` unconditionally publishes a late successful explicit verification after concurrent `invalidate()`: `verification_status_execution_allowed=True`, `stored_certificate_state=VERIFIED`"},{"contract_ids":["I16-A","MA-04"],"evidence_refs":["counterexample","python","model-discovery"],"id":"I16-A-MODEL-ADMISSION","severity":"P1","status":"CLOSED","title":"CLOSED historical I16-A-MODEL-ADMISSION: `python3 -B /home/workspace/Devflower/archives/devflower-model-admission-20261024/reviews/source-r1-recovery2/scratch/omitted_default_counterexample.py` receives a fresh successful omission, exposes the configured row only as registered, and returns `RESULT=REJECTED Blocked`; `tools/studio/model_catalog.py:140-166` no longer treats registration as execution admission."},{"contract_ids":["MA-09"],"evidence_refs":["python","host"],"id":"I14-03-TOOL-TIMING","severity":"P1","status":"CLOSED","title":"CLOSED historical I14-03-TOOL-TIMING: `tools/studio/tool_activity.py:58-92` retains validated native call IDs, ordered timestamps, conflict handling, and only derives duration from ordered valid timestamps; the same-candidate focused Python regressions pass."},{"contract_ids":["MA-09"],"evidence_refs":["python","native-sequence"],"id":"I14-04-HANDOFF-ATTEMPT","severity":"P3","status":"CLOSED","title":"CLOSED historical I14-04-HANDOFF-ATTEMPT: `tools/studio/workbench_scheduler.py:76-81,139-145` persists deterministic activation identity and its sole attempt before emitting a handoff; no replay transition was found."},{"contract_ids":["MA-09"],"evidence_refs":["python","source-privacy"],"id":"I14-03-TOOL-UNKNOWN-PROTOCOL","severity":"P1","status":"CLOSED","title":"CLOSED historical I14-03-TOOL-UNKNOWN-PROTOCOL: `tools/studio/tool_activity.py:9-47` recursively omits unknown, malformed, and decode-budget-exhausted native protocol values before visible projection."},{"contract_ids":["MA-08","MA-09"],"evidence_refs":["rebuild","chromium"],"id":"I16-F-01","severity":"P1","status":"CLOSED","title":"CLOSED historical I16-F-01: `tools/studio/workbench_ui/vendor/sim/PROVENANCE.md:1-9` retains upstream, licensing, modification, and non-authority boundaries; byte-bound UI rebuild and recorded Chromium regression are same-candidate."},{"contract_ids":["MA-09"],"evidence_refs":["python","host"],"id":"I16-WORKER-01","severity":"P1","status":"CLOSED","title":"CLOSED historical I16-WORKER-01: `tools/studio/workbench_worker.py:18-25` delegates unexpected failures to `tools/studio/workbench_failures.py:10-42`, which persists recovery-required state and stops only verified same-host/boot owned process groups."},{"contract_ids":["MA-09"],"evidence_refs":["native-sequence","native-merge","native-session"],"id":"I16-E5E6-01","severity":"P1","status":"CLOSED","title":"CLOSED historical I16-E5E6-01: `tools/studio/workbench_runtime.py:268-288` rejects unsafe resume without an identity-bound completion receipt, while same-candidate `sequence-proof.json` and `merge-proof.json` record passed real native sequence and merge executions."},{"contract_ids":["MA-01"],"evidence_refs":["python","baseline"],"id":"I16-JEV-01","severity":"P2","status":"CLOSED","title":"CLOSED historical I16-JEV-01: `docs/WORKBENCH.md:75-84` accurately limits Jev to documented TypeSafe System One identity and declares unconfigured independent credentials, n=0 calls, and unmeasured claims unknown rather than fabricating an integration."},{"contract_ids":["MA-01","MA-08"],"evidence_refs":["rebuild","source-privacy"],"id":"I16-HYG-01","severity":"P3","status":"CLOSED","title":"CLOSED historical I16-HYG-01: `python3 -I -B` recomputation against `/home/workspace/DevFlower/archives/devflower-model-admission-20261024/reviews/source-r1-recovery2/candidate-manifest.json` found 175 manifest entries, complete equality with the candidate tree, and SHA-256 `bbdfb20b8ee80b4eaab1b00f7597a3289cc23d467853e45622b2c770bad20308`."},{"contract_ids":["MA-09"],"evidence_refs":["chromium","editor"],"id":"I16-A11Y-01","severity":"P3","status":"CLOSED","title":"CLOSED historical I16-A11Y-01: `tools/studio/workbench_ui/index.jsx:243` renders every session tab opener and its close action as sibling buttons, and the same-candidate recorded Chromium suite reports 60 tests, 0 failures, 0 skips."}],"limitations":["This is infrastructure retry 2 of the same source-review round. `/home/workspace/DevFlower/archives/devflower-model-admission-20261024/reviews/source-r1-recovery2/candidate-manifest.json`, `diff-identity.json`, and `readable-source.diff` byte-match immutable `source-r1`; the recovery candidate is not a new candidate.","The initial focused-test command was invoked outside the candidate and failed to locate `test_model_admission`; the corrected exact command `cd /home/workspace/DevFlower/archives/devflower-model-admission-20261024/reviews/source-r1-recovery2/candidate && PYTHONDONTWRITEBYTECODE=1 PYTHONPATH=\"$PWD/tools:$PWD/tests\" python3 -B -m unittest test_model_admission -v` completed 29/29 passing. `test_issue16` plus `test_workbench_runtime.HttpTests` completed 37/37 passing.","The supplied same-candidate evidence manifest hashes cleanly (40/40) and records 546 Python tests, 6 host tests, 8 editor tests, 12 projection tests, syntax checks, and Chromium 60/60 passing. Those results do not cover the new verification/invalidation interleaving counterexample.","The two excluded generated bundles were not read: recovery2 candidate bytes match manifest for `tools/studio/static/workbench.js` and `tools/studio/static/workbench.css`; evidence `rebuild.json` records byte-identical source rebuild output for both.","The fixed external Stable Gate is expressly post-report and was not executed; no merge, Stable promotion, or personal UX acceptance is claimed. MA-10 is therefore blocked independently of the P1 correction.","Actual physical backend and effective effort remain unknown where providers do not prove them; native admission evidence reports that limitation rather than inferring it."],"round":1,"run_id":"77f822033450473d8b1040ab620ef4f3","schema_version":1,"verdict":"NEEDS_CORRECTION"}
